{
  "business_model_id": "BM-DEMO-001",
  "version": 1,
  "opportunity_ref": "O-DEMO-001",
  "state": "validating",
  "value_proposition": "Turn should-we-build decisions into a fast, testable, human-authorized workflow before coding agents consume budget.",
  "target_segment": "Product and innovation teams using coding agents",
  "target_user": {
    "description": "A product lead responsible for discovery and delivery decisions.",
    "value_or_need": "A concise way to identify the next experiment and prevent unauthorized implementation."
  },
  "economic_buyer": {
    "description": "A product, innovation, or engineering leader who owns the MVP budget.",
    "value_or_need": "Reduced waste and decision evidence that survives handoffs and audits."
  },
  "willingness_to_pay_or_internal_roi_hypothesis": "A team will adopt the workflow if it prevents at least one unnecessary multi-day implementation cycle per quarter.",
  "revenue_or_economic_value_model": "Value is measured as avoided engineering time plus faster evidence-backed investment decisions.",
  "acquisition_distribution_hypothesis": "Teams will adopt TEMPO through a repository template and a one-command judge/demo workflow.",
  "adoption_friction": [
    "Teams must express business assumptions as structured artifacts",
    "A human must explicitly approve the decision brief and implementation warrant"
  ],
  "key_partners_or_dependencies": [
    "Git",
    "Python 3.10 or newer"
  ],
  "rough_cost_drivers": [
    {
      "driver": "Workflow integration",
      "basis": "Repository-local Python and CI configuration",
      "uncertainty": "low"
    }
  ],
  "alternatives_and_differentiation": [
    {
      "alternative": "Static PRD or approval message",
      "differentiation": "TEMPO binds evidence, scope, budget, deadline, and human authority to machine-enforced hashes."
    }
  ],
  "defensibility_hypothesis": "The durable advantage is a portable decision ledger and deterministic enforcement contract rather than a proprietary prompt.",
  "material_risks": [
    {
      "risk_id": "BR-DEMO-001",
      "category": "trust",
      "description": "A synthetic demo could be mistaken for real customer validation.",
      "resolution_status": "mitigated"
    }
  ],
  "hypothesis_refs": ["H-PROBLEM-001"],
  "evidence_refs": ["E-INTERVIEW-A", "E-INTERVIEW-B"],
  "owner": "human:product-lead",
  "created_at": "2026-07-17T12:00:00Z",
  "updated_at": "2026-07-17T12:00:00Z"
}
